"Title","WorkoutType","WorkoutDescription","PlannedDuration","PlannedDistanceInMeters","WorkoutDay","CoachComments","DistanceInMeters","PowerAverage","PowerMax","Energy","AthleteComments","TimeTotalInHours","VelocityAverage","VelocityMax","CadenceAverage","CadenceMax","HeartRateAverage","HeartRateMax","TorqueAverage","TorqueMax","IF","TSS","HRZone1Minutes","HRZone2Minutes","HRZone3Minutes","HRZone4Minutes","HRZone5Minutes","HRZone6Minutes","HRZone7Minutes","HRZone8Minutes","HRZone9Minutes","HRZone10Minutes","PWRZone1Minutes","PWRZone2Minutes","PWRZone3Minutes","PWRZone4Minutes","PWRZone5Minutes","PWRZone6Minutes","PWRZone7Minutes","PWRZone8Minutes","PWRZone9Minutes","PWRZone10Minutes","Rpe","Feeling"
"Pool Swim: Aerobic Endurance","Swim","Warm Up: 2 x (100 FS Breathe every 3 in Z2 + 5 sec rests), 2 x (100 Pull in Z2 + 100 Drill in Z2 + 5 sec rests), 2 x (100 FS Breathe every 5 in Z2 + 5 sec rests). Main Set: 2 x (400 FS in Z2 + 50 FS in Z4 + 5 sec rests), 2 x (200 Pull in Z2 + 100 FS in Z3 + 5 sec rests), 2 x (100 FS in Z2 + 50 FS in Z4 + 5 sec rests), 1 x (100 Pull in Z2 + 100 FS in Z4 + 5 secs rest). Warm Down: 1 x (200 Choice in Z2).","1.21972222222222","3000","2022-05-20","","3000","","","","","1.10329139179654","0.753579502637528","","24","","","","","","1.00456990924998","111.85","","","","","","","","","","","","","","","","","","","","","",""
"Build Phase 1: Strength and Conditioning #2","Strength","Please check the link below for full exercise instructions, progressions, alternatives and videos: https://www.myprocoach.net/wp-content/uploads/SC-Triathlon.pdf Upper Body and Core Strength: 1. Squat: 3 x 10 (Exercise 1) 2. Lat & Front Raise Combo: 3 x 6 (Exercise 11) 3. Tricep Kickback: 3 x 8 (Exercise 16) 4. Bench Press: 3 x 8 (Exercise 14) 5. Dumbbell Pullover: 3 x 8 (Exercise 15) 6. Renegade Row: 3 x 5 (Exercise 22) 7: Glute Bridge: 3 x 14 (Exercise 18) 8. Sit-Up: 3 x 12 (Exercise 27) 9. Reverse Crunch: 3 x 16 (Exercise 28) Flexibility: 5-10 minutes Notes: 1. 3 x 8 = 3 sets of 8 repetitions with a rest between sets. 2. Rests are 45 secs - 2-3 mins as required. 3. When an exercise alternates right and left, the right PLUS left movement is 1 rep. 4. For unilateral exercises, perform reps on the right, then repeat on the left. Then move to next set. 5. Breathe out on exertion and maintain form throughout. 6. For flexibility see the link below or choose stretches that work well for you.","0.666666666666667","","2022-05-20","Build Phase: During the build phase, your workouts are designed to develop power, balance and neuromuscular control. Form is key, reduce the intensity if you cannot hold your form. Resistance during the Build Phase: The most strength gains are made during this phase. Progress intensity by adding resistance only if you are able to maintain correct form throughout. Sets should feel more challenging, however be cautious of negatively impacting your following workouts. Perform strength and conditioning once or twice each week. Avoid the ‘no pain, no gain’ thinking. Strength will compliment your training making you more powerful, less prone to injury and help you focus on range of movement required for all three disciplines. It should not inhibit your subsequent workouts.","","","","","","","","","","","","","","","","","","","","","","","","","","","","","","","","","","","","","",""
"Endurance Ride With A Sub Threshold Effort","Bike","Ride mainly in Z2 today. At some point (once you're warmed up) do a 30 minute effort at upper Z3 to low Z4.","3","","2022-05-21","","97907.84375","163","281","1769.97","","3.00527787208557","9.04899978637695","","72","","144","163","","","0.754651540705095","170.67","0","149","31","0","0","","","","","","131","24","22","1","0","","","","","","",""
"Aerobic Endurance Ride","Bike","Ride mainly in Z2. Nice and steady.","2.25","","2022-05-22","","71079.2109375","156","277","1270.634","","2.25416660308838","8.75800037384033","","73","","138","150","","","0.712517752226519","114.35","0","135","0","0","0","","","","","","119","15","1","0","0","","","","","","",""
"Run Off The Bike","Run","Get off your bike and do a steady run. All in Z2.","0.75","","2022-05-22","","7339.14013671875","","","","","0.750552773475647","2.71600008010864","","86","","148","157","","","0.745368539750717","45.86","17","23","5","0","0","","","","","","","","","","","","","","","","",""
"Build Phase 1 Week 4. Active Recovery.","Other","Make the most of your recovery weeks. Don't be tempted to do more. Let your body adapt to all the training, so you're raring to go next week.","","","2022-05-23","","","","","","","","","","","","","","","","","","","","","","","","","","","","","","","","","","","","","","",""
"Pool Swim: Recovery","Swim","Warm Up: 1 x (100 FS in Z2 + 100 Drill in Z2 + 5 secs rest), 2 x (50 Breast in Z2 + 50 Back in Z2 + 5 sec rests). Main Set: 1 x (100 FS in Z2 + 100 Pull in Z2 + 15 secs rest), 1 x (200 FS in Z2 + 200 Pull in Z2 + 15 secs rest), 1 x (200 FS in Z2 + 200 Pull in Z2 + 15 secs rest), 1 x (100 FS in Z2 + 100 Pull in Z2 + 15 secs rest). Warm Down: 1 x (200 Choice in Z2).","0.750833333333333","1800","2022-05-23","","1800","","","","","0.639986112912496","0.779220779220779","","24","","","","","","1.03908504666401","71.8","","","","","","","","","","","","","","","","","","","","","",""
"Recovery Intensities","Run","","0.583333333333333","","2022-05-24","","6713.22998046875","","","","","0.584418892860413","3.19099998474121","","90","","160","189","","","0.890563932605202","50.66","10","6","4","5","10","","","","","","","","","","","","","","","","",""
"Build Phase 1: Strength and Conditioning #1","Strength","Please check the link below for full exercise instructions, progressions, alternatives and videos: https://www.myprocoach.net/wp-content/uploads/SC-Triathlon.pdf Legs and Core Strength: 1. Squat: 3 x 10 (Exercise 1) 2. Squat Jump: 3 x 12 (Exercise 2) 3. Single Leg Squat: 3 x 10 (Exercise 3) 4. High Knee: 3 x 10 (Exercise 9) 5. Box Jump: 3 x 8 (Exercise 10) 6. Bicycle Crunch: 4 x 10 (Exercise 26) 7. Plank: 3 reps (Exercise 21) 8. Spider Climber: 3 x 10 (Exercise 25) 9. Side Plank: 3 reps (Exercise 23) Flexibility: 5-10 minutes Notes: 1. 3 x 8 = 3 sets of 8 repetitions with a rest between sets. 2. Rests are 45 secs - 2-3 mins as required. 3. When an exercise alternates right and left, the right PLUS left movement is 1 rep. 4. For unilateral exercises, perform reps on the right, then repeat on the left. Then move to next set. 5. Breathe out on exertion and maintain form throughout. 6. For flexibility see the link below or choose stretches that work well for you.","0.666666666666667","","2022-05-24","Build Phase: During the build phase, your workouts are designed to develop power, balance and neuromuscular control. Form is key, reduce the intensity if you cannot hold your form. Resistance during the Build Phase: The most strength gains are made during this phase. Progress intensity by adding resistance only if you are able to maintain correct form throughout. Sets should feel more challenging, however be cautious of negatively impacting your following workouts. Perform strength and conditioning once or twice each week. Avoid the ‘no pain, no gain’ thinking. Strength will compliment your training making you more powerful, less prone to injury and help you focus on range of movement required for all three disciplines. It should not inhibit your subsequent workouts.","","","","","","","","","","","","","","","","","","","","","","","","","","","","","","","","","","","","","",""
"Rest Day","Day Off","","","","2022-05-25","","","","","","","","","","","","","","","","","","","","","","","","","","","","","","","","","","","","","","",""
"Speed Workout Bike","Bike","Warm Up: 15 mins in Z2. Main Set: 9 mins in low Z4 + 60 sec recoveries in Z1, 7 mins in low Z4 + 60 sec recoveries in Z1, 5 mins in low Z4. Warm Down: 5 mins in Z2.","0.716666666666667","","2022-05-26","","18763.23046875","145","434","370.009","","0.707192778587341","7.36899995803833","","69","","138","180","","","0.863536670081365","46.09","4","28","9","1","0","","","","","","28","3","4","4","2","","","","","","",""
"Build Phase 1: Strength and Conditioning #2","Strength","Please check the link below for full exercise instructions, progressions, alternatives and videos: https://www.myprocoach.net/wp-content/uploads/SC-Triathlon.pdf Upper Body and Core Strength: 1. Squat: 3 x 10 (Exercise 1) 2. Lat & Front Raise Combo: 3 x 6 (Exercise 11) 3. Tricep Kickback: 3 x 8 (Exercise 16) 4. Bench Press: 3 x 8 (Exercise 14) 5. Dumbbell Pullover: 3 x 8 (Exercise 15) 6. Renegade Row: 3 x 5 (Exercise 22) 7: Glute Bridge: 3 x 14 (Exercise 18) 8. Sit-Up: 3 x 12 (Exercise 27) 9. Reverse Crunch: 3 x 16 (Exercise 28) Flexibility: 5-10 minutes Notes: 1. 3 x 8 = 3 sets of 8 repetitions with a rest between sets. 2. Rests are 45 secs - 2-3 mins as required. 3. When an exercise alternates right and left, the right PLUS left movement is 1 rep. 4. For unilateral exercises, perform reps on the right, then repeat on the left. Then move to next set. 5. Breathe out on exertion and maintain form throughout. 6. For flexibility see the link below or choose stretches that work well for you.","0.666666666666667","","2022-05-26","Build Phase: During the build phase, your workouts are designed to develop power, balance and neuromuscular control. Form is key, reduce the intensity if you cannot hold your form. Resistance during the Build Phase: The most strength gains are made during this phase. Progress intensity by adding resistance only if you are able to maintain correct form throughout. Sets should feel more challenging, however be cautious of negatively impacting your following workouts. Perform strength and conditioning once or twice each week. Avoid the ‘no pain, no gain’ thinking. Strength will compliment your training making you more powerful, less prone to injury and help you focus on range of movement required for all three disciplines. It should not inhibit your subsequent workouts.","","","","","","","","","","","","","","","","","","","","","","","","","","","","","","","","","","","","","",""
"Pool Swim: Endurance/Technique","Swim","Warm Up: 1 x (100 FS in Z2 Breathe every 3 + 5 secs rest), 1 x (200 Pull in Z2 Breathe every 5 + 5 secs rest), 1 x (100 FS in Z2 Breathe every 3 + 5 secs rest). Main Set: 4 x (100 Drill in Z2 + 100 FS in Z3 + 10 sec rests). Warm Down: 2 x (50 Back in Z2 + 50 Breast in Z2 + 5 sec rests), 2 x (50 Pull in Z2 + 50 Drill in Z2 + 5 sec rests), 1 x (200 FS in Z2).","0.743055555555556","1800","2022-05-27","","1800","","","","","0.646742225223117","0.771869639794168","","24","","","","","","1.02823037381019","70.31","","","","","","","","","","","","","","","","","","","","","",""
"Aerobic Endurance Run","Run","Nice steady social run in Z1-Z2.","1","","2022-05-28","","10005.83984375","","","","","1.05669665336609","2.63000011444092","","87","","149","161","","","0.802878348738377","75.56","14","41","8","0","0","","","","","","","","","","","","","","","","",""
"Aerobic Endurance Ride","Bike","Easy/steady Z2 ride today. Feel free to stop for a coffee/snack. Enjoy it, save your legs.","2","","2022-05-29","","63343.109375","151","361","1243.82","","2.28655886650085","7.69500017166138","","83","","147","169","","","0.743500573970141","126.29","2","106","29","0","0","","","","","","87","33","7","4","6","","","","","","",""
"Build Phase 2 Week 1","Other","","","","2022-05-30","","","","","","","","","","","","","","","","","","","","","","","","","","","","","","","","","","","","","","",""
"IRONMAN 70.3 Sustained Pace (Build)","Run","Warm Up:. 5 mins in Z1-2, 3 mins in Z3, 3 mins in Z2. Main Set: 4 x (9 mins in mid Z3 + 3 min recoveries in Z1-2). Warm Down: 5 mins in Z1-2.","1.06666666666667","","2022-05-30","","12395.009765625","","","","","1.067009806633","3.22699999809265","","90","","167","184","","","0.917786378171277","99.72","4","4","6","35","14","","","","","","","","","","","","","","","","","5"
"Pool Swim: Threshold Efforts","Swim","Warm Up: 1 x (100 FS in Z2 + 100 Pull in Z2 + 5 secs rest), 1 x (50 FS in Z2 + 50 FS in Z3 + 10 secs rest), 1 x (100 FS in Z2 + 100 Pull in Z4 + 15 secs rest). Main Set: 1 x (400 FS in Z4 + 30 secs rest), 1 x (400 Pull in Z4 + 30 secs rest), 2 x (200 FS in Z4 + 15 sec rests), 2 x (200 Pull in Z4 + 15 sec rests). Warm Down: 1 x (100 Pull in Z2 + 100 FS in Z2), 1 x (100 Choice in Z2).","0.946111111111111","2400","2022-05-30","","2400","","","","","0.829541114171346","0.802139037433155","","25","","","","","","1.06886404003301","101.3","","","","","","","","","","","","","","","","","","","","","",""
"IRONMAN 70.3 Power Slope","Bike","Warm Up: 5 mins in Z1-2, 5 x (15 secs in Z3, 15 secs Z1-2, 15 secs in Z4, 15 secs in Z1-2) 5 mins in Z2. Main Set: 1 x (10 mins in Z3 + 7 mins in Z4), 4 mins recovery in Z1-2, 1 x (8 mins in Z3 + 5 mins in Z4), 3 mins recovery in Z1-2, 1 x (6 mins in Z3 + 3 mins in Z4), 2 mins recovery in Z1-2. Warm down. 5 mins in Z1-2.","1.13333333333333","","2022-05-31","","32514.849609375","172","260","708.327","","1.14002168178558","7.92199993133545","","73","","149","166","","","0.815913106027515","75.56","1","33","35","0","0","","","","","","26","20","10","8","0","","","","","","",""
"Build Phase 2: Strength and Conditioning #1","Strength","Please check the link below for full exercise instructions, progressions, alternatives and videos: https://www.myprocoach.net/wp-content/uploads/SC-Triathlon.pdf Legs and Core Strength: 1. Squat: 3 x 10 (Exercise 1) 2. Squat Jump: 4 x 10 (Exercise 2) 3. High Knee: 4 x 8 (Exercise 9) 4. Calf Raise: 4 x 10 (Exercise 8) 5. Box Jump: 3 x 10 (Exercise 10) 6. Bicycle Crunch: 4 x 10 (Exercise 26) 7. Plank: 3 reps (Exercise 21) 8. Mountain climber: 3 x 10 (Exercise 24) 9. Side Plank: 3 reps (Exercise 23) Flexibility: 5-10 minutes Notes: 1. 3 x 8 = 3 sets of 8 repetitions with a rest between sets. 2. Rests are 45 secs - 2-3 mins as required. 3. When an exercise alternates right and left, the right PLUS left movement is 1 rep. 4. For unilateral exercises, perform reps on the right, then repeat on the left. Then move to next set. 5. Breathe out on exertion and maintain form throughout. 6. For flexibility see the link below or choose stretches that work well for you.","0.666666666666667","","2022-05-31","Build Phase: During the build phase, your workouts are designed to develop power, balance and neuromuscular control. Form is key, reduce the intensity if you cannot hold your form. Resistance during the Build Phase: The most strength gains are made during this phase. Progress intensity by adding resistance only if you are able to maintain correct form throughout. Sets should feel more challenging, however be cautious of negatively impacting your following workouts. Perform strength and conditioning once or twice each week. Avoid the ‘no pain, no gain’ thinking. Strength will compliment your training making you more powerful, less prone to injury and help you focus on range of movement required for all three disciplines. It should not inhibit your subsequent workouts.","0","","","","","0.847071409225464","0","","","","109","146","","","0.595018147442711","33.08","21","0","0","0","0","","","","","","","","","","","","","","","","",""
"Aerobic Endurance Run","Run","A nice steady run, mainly in Z1-Z2.","1.66666666666667","","2022-06-01","","16013.51953125","","","","","1.7519416809082","2.53900003433228","","86","","150","160","","","0.755519766547913","112.35","15","84","6","0","0","","","","","","","","","","","","","","","","",""
"Pool Swim: Recovery","Swim","Warm Up: 1 x (100 FS in Z2 + 100 Drill in Z2 + 5 secs rest), 1 x (50 Breast in Z2 + 50 Back in Z2 + 5 secs rest). Main Set: 1 x (100 FS in Z2 + 100 Pull in Z2 + 15 secs rest), 1 x (200 FS in Z2 + 200 Pull in Z2 + 15 secs rest), 1 x (200 FS in Z2 + 200 Pull in Z2 + 15 secs rest), 1 x (100 FS in Z2 + 100 Pull in Z2 + 15 secs rest). Warm Down: 1 x (100 Choice in Z2).","0.668333333333333","1600","2022-06-01","","1600","","","","","0.567838335567051","0.78125","","24","","","","","","1.04098486151137","64.06","","","","","","","","","","","","","","","","","","","","","",""
"Other","Other","","","","2022-06-01","","0","","","","","0.083645835518837","0","","","","66","78","","","0.536813590475202","2.5","","","","","","","","","","","","","","","","","","","","","",""
"Rest Day","Day Off","","","","2022-06-02","","","","","","","","","","","","","","","","","","","","","","","","","","","","","","","","","","","","","","",""
"Pool Swim: Aerobic Endurance","Swim","Warm Up: 1 x (100 FS in Z2 + 100 Pull in Z2 + 5 secs rest), 2 x (100 FS in Z2 + 100 Drill in Z2 + 5 sec rests). Main Set: 1 x (400 Pull in Z2 + 10 secs rest), 4 x (100 FS in Z3 + 5 sec rests), 3 x (200 Pull in Z2 + 5 sec rests), 3 x (200 FS in Z3 + 5 sec rests). Warm Down: 2 x (50 Back in Z2 + 50 Breast in Z2) + 5 secs rest, 1 x (100 Pull in Z2 + 100 Choice in Z2).","1.21888888888889","3000","2022-06-03","","1000","","","","","0.633286952972412","0.438628612943931","","20","","","","","","0.390465265549565","3.77","","","","","","","","","","","","","","","","","","","","","",""
"Build Phase 2: Strength and Conditioning #2","Strength","Please check the link below for full exercise instructions, progressions, alternatives and videos: https://www.myprocoach.net/wp-content/uploads/SC-Triathlon.pdf Upper Body and Core Strength: 1. Squat: 3 x 10 (Exercise 1) 2. Lat & Front Raise Combo: 3 x 5 (Exercise11) 3. Bent Over Row: 3 x 8 (Exercise 12) 4. Tricep Dip: 3 x 12 (Exercise 17) 5. Renegade Row: 3 x 4 (Exercise 22) 6: Glute Bridge: 3 x 14 (Exercise 18) 7. Spider Climber: 3 x 10 (Exercise 25) 8. Sit-Up: 3 x 12 (Exercise 27) 9. Reverse Crunch: 3 x 16 (Exercise 28) Flexibility: 5-10 minutes Notes: 1. 3 x 8 = 3 sets of 8 repetitions with a rest between sets. 2. Rests are 45 secs - 2-3 mins as required. 3. When an exercise alternates right and left, the right PLUS left movement is 1 rep. 4. For unilateral exercises, perform reps on the right, then repeat on the left. Then move to next set. 5. Breathe out on exertion and maintain form throughout. 6. For flexibility see the link below or choose stretches that work well for you.","0.666666666666667","","2022-06-03","Build Phase: During the build phase, your workouts are designed to develop power, balance and neuromuscular control. Form is key, reduce the intensity if you cannot hold your form. Resistance during the Build Phase: The most strength gains are made during this phase. Progress intensity by adding resistance only if you are able to maintain correct form throughout. Sets should feel more challenging, however be cautious of negatively impacting your following workouts. Perform strength and conditioning once or twice each week. Avoid the ‘no pain, no gain’ thinking. Strength will compliment your training making you more powerful, less prone to injury and help you focus on range of movement required for all three disciplines. It should not inhibit your subsequent workouts.","","","","","","","","","","","","","","","","","","","","","","","","","","","","","","","","","","","","","",""
"Endurance Ride With Sub Threshold Efforts","Bike","Ride mainly in Z2. At some point (once you're warmed up) do: 3 x (12 min efforts in upper Z3 to low Z4 + 3 min recoveries in Z2).","3.25","","2022-06-04","","63089.76171875","157","305","1140.933","","2.00833344459534","8.72599983215332","","73","","142","155","","","0.7181360957431","103.16","0","118","2","0","0","","","","","","107","13","1","0","0","","","","","","",""
"Aerobic Endurance Ride","Bike","Ride mainly in Z2 today.","2.25","","2022-06-05","","29112.130859375","184","363","625.031","","0.95721161365509","8.44799995422363","","86","","161","181","","","0.888611323963542","74.74","0","4","50","3","0","","","","","","13","18","14","4","5","","","","","","",""
"Run Off The Bike","Run","Get off your bike and do a steady run. All in Z2.","0.75","","2022-06-05","","6907.06982421875","","","","","0.494401395320892","3.88100004196167","","94","","176","186","","","1.15353231083385","71.61","0","0","0","13","16","","","","","","","","","","","","","","","","",""
"Open Water Swimming","Swim","","","","2022-06-05","","678.340026855469","","","","","0.256261944770813","0.735000014305115","","27","","153","162","","","0.977940577912103","23.97","1","7","8","0","0","","","","","","","","","","","","","","","","",""
"Transition","Other","","","","2022-06-05","","103.169998168945","","","","","0.0337894447147846","0.84799998998642","","19","","175","182","","","0.950963831437226","3.09","0","0","0","1","1","","","","","","","","","","","","","","","","",""
"Transition","Other","","","","2022-06-05","","82.8099975585938","","","","","0.0192933343350887","1.19200003147125","","83","","159","171","","","0.830606739634928","1.35","0","0","0","1","0","","","","","","","","","","","","","","","","",""
"Build Phase 2 Week 2","Other","","","","2022-06-06","","","","","","","","","","","","","","","","","","","","","","","","","","","","","","","","","","","","","","",""
"IRONMAN 70.3 Sustained Pace (Build)","Run","Warm Up:. 5 mins in Z1-2, 3 mins in Z3, 3 mins in Z2. Main Set: 3 x (14 mins in mid Z3 + 3 min recoveries in Z1-2). Warm Down: 5 mins in Z1-2.","1.11666666666667","","2022-06-06","","5433.669921875","","","","","0.552082240581512","2.73399996757507","","87","","138","145","","","0.867147989335903","45.3","33","0","0","0","0","","","","","","","","","","","","","","","","",""
"Pool Swim: Threshold Efforts","Swim","Warm Up: 1 x (100 FS in Z2 + 100 FS in Z4 + 10 secs rest), 1 x (50 FS in Z2 + 150 FS in Z4 + 15 secs rest), 1 x (200 FS in Z4 + 20 secs rest). Main Set: Repeat 3 sets of 500 as below: 1 x (100 FS in Z2 + 5 secs rest), 1 x (100 FS in Z3 + 5 secs rest), 1 x (100 FS in Z4 + 5 secs rest), 1 x (100 FS in Z5 + 5 secs rest), 1 x (100 Pull in Z2 + 5 secs rest). Warm Down: 1 x (100 Kick in Z2 + 100 FS in Z2 + 5 secs rest), 1 x (50 Back in Z2 + 50 Breast in Z2 + 5 secs rest), 1 x (200 Choice in Z2).","1.03611111111111","2600","2022-06-06","","2400","","","","","0.84582694583469","0.786112020962987","","25","","","","","","1.0482837784172","97.44","","","","","","","","","","","","","","","","","","","","","",""
"IRONMAN 70.3 Power Slope","Bike","Warm Up: 5 mins in Z1-2, 5 x (15 secs in Z3, 15 secs Z1-2, 15 secs in Z4, 15 secs in Z1-2) 5 mins in Z2. Main Set: 1 x (12 mins in Z3 + 8 mins in Z4), 4 mins recovery in Z1-2, 1 x (7 mins in Z3 + 4 mins in Z4), 3 mins recovery in Z1-2, 1 x (5 mins in Z3 + 3 mins in Z4), 2 mins recovery in Z1-2. Warm down. 5 mins in Z1-2.","1.13333333333333","","2022-06-07","","37852.12890625","173","294","709.677","","1.13566780090332","9.25800037384033","","74","","147","164","","","0.821734219166097","76.28","1","40","27","0","0","","","","","","26","20","7","9","0","","","","","","",""
"Build Phase 2: Strength and Conditioning #1","Strength","Please check the link below for full exercise instructions, progressions, alternatives and videos: https://www.myprocoach.net/wp-content/uploads/SC-Triathlon.pdf Legs and Core Strength: 1. Squat: 3 x 10 (Exercise 1) 2. Squat Jump: 4 x 10 (Exercise 2) 3. High Knee: 4 x 8 (Exercise 9) 4. Calf Raise: 4 x 10 (Exercise 8) 5. Box Jump: 3 x 10 (Exercise 10) 6. Bicycle Crunch: 4 x 10 (Exercise 26) 7. Plank: 3 reps (Exercise 21) 8. Mountain Climber: 3 x 10 (Exercise 24) 9. Side Plank: 3 reps (Exercise 23) Flexibility: 5-10 minutes Notes: 1. 3 x 8 = 3 sets of 8 repetitions with a rest between sets. 2. Rests are 45 secs - 2-3 mins as required. 3. When an exercise alternates right and left, the right PLUS left movement is 1 rep. 4. For unilateral exercises, perform reps on the right, then repeat on the left. Then move to next set. 5. Breathe out on exertion and maintain form throughout. 6. For flexibility see the link below or choose stretches that work well for you.","0.666666666666667","","2022-06-07","Build Phase: During the build phase, your workouts are designed to develop power, balance and neuromuscular control. Form is key, reduce the intensity if you cannot hold your form. Resistance during the Build Phase: The most strength gains are made during this phase. Progress intensity by adding resistance only if you are able to maintain correct form throughout. Sets should feel more challenging, however be cautious of negatively impacting your following workouts. Perform strength and conditioning once or twice each week. Avoid the ‘no pain, no gain’ thinking. Strength will compliment your training making you more powerful, less prone to injury and help you focus on range of movement required for all three disciplines. It should not inhibit your subsequent workouts.","0","","","","","0.629164457321167","0","","","","96","119","","","0.570714111763959","22.43","2","0","0","0","0","","","","","","","","","","","","","","","","",""
"Aerobic Endurance Run","Run","Run mainly in Z1-Z2. Preferably off road.","1.66666666666667","","2022-06-08","","16071.0302734375","","","","","1.66715002059937","2.67799997329712","","86","","143","153","","","0.838679953873048","131.58","86","14","0","0","0","","","","","","","","","","","","","","","","",""
"Pool Swim: Endurance/Technique","Swim","Warm Up: 1 x (100 Pull in Z2 + 100 Drill in Z2 + 5 secs rest), 1 x (100 Drill in Z2 + 100 Pull in Z2 + 5 secs rest). Main Set: 2 x (100 Pull in Z2 + 100 Drill in Z2 + 5 sec rests), 1 x (50 Kick in Z2 + 50 Kick in Z4 + 10 secs rest), 2 x (200 Drill in Z2 + 100 Pull in Z2 + 5 sec rests), 1 x (50 Kick in Z2 + 50 Kick in Z4 + 10 secs rest). Warm Down: 1 x (50 Breast in Z2 + 50 FS in Z2), 1 x (50 Back in Z2 + 50 FS in Z2).","0.74","1800","2022-06-08","","1800","","","","","0.647670003043281","0.770218228498074","","25","","","","","","1.02675744881697","70.11","","","","","","","","","","","","","","","","","","","","","",""
